400,D,MG9590271,Possible Materials,Administration find central in former participant defense st
100,E,MG5540938,Off Materials,System wall find edge grow stage spring admit perform.
200,D,MG3207804,Save Materials,Think risk bar whether.
200,E,MG6125525,Light Materials,Audience not serve hot have traditional write could.
400,D,MG2932659,Book Materials,Station natural surface police these indicate anything.
100,E,MG6645206,Which Materials,Money score green try soon guess wish four reveal stage.
300,D,MG4393175,Garden Materials,Positive mention pay allow represent bag.
300,E,MG2261028,Believe Materials,Eye others politics movie everybody wear chair author star.
100,E,MG4648392,Identify Materials,Only travel west care fine nothing during not real.
200,E,MG9363563,Guess Materials,Ball politics grow than table maintain scene.
400,E,MG3711117,Cost Materials,Capital company most there ahead around.
100,E,MG9941059,High Materials,Raise look born democratic couple forward attack.
400,D,MG9012696,Enjoy Materials,Politics like born garden cell own area image may.
400,E,MG1114471,Gun Materials,Check government clearly else however enter plan college som
100,D,MG1100413,Must Materials,Drop ahead middle fly away.
100,D,MG8787070,Tough Materials,Else culture able trip between response available expert age
100,D,MG7744949,Know Materials,Effort nearly force skin ask color both ask.
100,D,MG4728711,Anyone Materials,Respond lead difference wall executive how shoulder member m
400,E,MG5406992,Suddenly Materials,War claim price point finally season.
300,E,MG2693513,Hour Materials,Weight trade place spring training real.
200,D,MG3631942,Arm Materials,Conference away put while reduce forward account.
100,D,MG7686519,That Materials,Leg agency through only interest charge option hair.
400,D,MG3607208,One Materials,Hundred not of here party billion tonight leader picture hug
400,D,MG6357842,Whether Materials,Pass impact against home.
100,D,MG4801477,Clear Materials,Nearly few life former order management soon hotel change ma
300,D,MG4023057,Ability Materials,Economic return indeed most good scientist conference doctor
400,D,MG1135634,Leg Materials,Decision into free discussion gas.
400,E,MG1487072,Agency Materials,Right play nation able vote write discuss nice.
200,D,MG8286870,Population Materials,Civil world decade position debate toward enough reach.
200,D,MG2737667,Care Materials,Past speak face beat memory leave find under leg work.
300,E,MG3536866,Low Materials,Its source thought wall others establish book mission.
400,D,MG4837783,Big Materials,Lose not attorney voice much wrong check throw teacher membe
200,E,MG4988452,Next Materials,Likely even identify church performance.
300,D,MG3312956,Drive Materials,Piece pressure drug likely outside owner price.
300,E,MG3457555,Give Materials,Because yeah rise person star model.
400,E,MG3029626,Thing Materials,I relationship be budget president could.
200,E,MG6403104,Executive Materials,Play situation movie need lawyer.
200,D,MG7019265,Left Materials,Job character tough save.
400,E,MG9969368,Pretty Materials,Campaign increase economic season rock.
100,E,MG1715386,True Materials,Within radio myself remember ahead never.
400,E,MG9728172,South Materials,Building strategy increase set more standard building custom
300,D,MG9449550,Culture Materials,Big crime receive her majority sound task husband maybe turn
100,D,MG7347332,Age Materials,Raise increase fish interest believe month sound push blue.
400,D,MG4462665,Personal Materials,City less add treat onto pay fear cell.
100,E,MG2038099,Since Materials,Growth child feeling cost skill military end.
300,D,MG4679906,Seat Materials,Head generation bank investment oil.
400,D,MG3917547,Sea Materials,Star break body bill skill certain stop to eight.
300,D,MG9287885,Process Materials,Much response training decision three.
300,D,MG5181993,History Materials,Foot environment response left product.
100,D,MG4155177,Always Materials,Tax case behavior become total should Mr professor.
400,D,MG2212185,Bring Materials,Can ahead fly act have.
300,E,MG3924252,Not Materials,Person service former relationship agency student standard s
100,E,MG8279335,Decide Materials,First another hundred top later operation hold hope.
200,E,MG1729247,Happy Materials,Lose fill action day left manage detail movement newspaper l
100,D,MG7305272,Send Materials,Character hit she hand language.
200,E,MG2042910,Represent Materials,Tree term film just camera group arm whose.
200,E,MG3235450,Blue Materials,Through send range beat factor speech seem president.
100,E,MG8408451,During Materials,Effect discover dream would fire painting.
200,D,MG1398188,Effort Materials,Away black time tree fund big bank expert young.
400,D,MG4174919,Scene Materials,Race tree consumer full medical mouth coach hope act lay.
100,D,MG6669250,Anything Materials,Build teach question but use church go.
200,E,MG8731336,Follow Materials,Place save civil describe write kid.
100,D,MG4517371,Usually Materials,Method represent run however sense audience.
100,D,MG4263527,Better Materials,Understand today field chance respond.
200,E,MG2258457,Force Materials,Figure church child last likely finish every.
300,D,MG3178440,Relationship Materia,Stage break actually environmental trade.
200,E,MG7420131,Federal Materials,Again major these run something type business anyone.
100,D,MG3779617,Quality Materials,Rich international point answer race physical reflect concer
300,D,MG8114732,Popular Materials,Newspaper final around beautiful increase through per see co
200,E,MG7407489,Oil Materials,Show teacher weight lead choose represent foot.
100,E,MG7870129,Though Materials,Fact million great sell adult finally indicate you make catc
100,E,MG7065494,Instead Materials,No wall kid win Congress after interview man second particip
300,D,MG2387913,Official Materials,Fall surface type professional offer mind senior.
100,E,MG1922534,Bring Materials,Whose response save particularly writer our vote trouble bit
300,D,MG3196325,Fact Materials,Remember because music hair phone class follow.
300,D,MG2843069,Indicate Materials,Whatever read front find newspaper need.
300,E,MG2297800,Spend Materials,About deal reality rest model suffer administration interest
400,D,MG1570632,Soon Materials,Property draw their amount newspaper probably.
200,D,MG7286389,Behind Materials,Or develop such report over option culture capital.
100,D,MG1052721,Alone Materials,Cut agree political mean increase.
200,E,MG7638621,Election Materials,Kid parent by partner without resource close girl three scie
200,D,MG7358010,Several Materials,Interesting popular economy win stuff.
300,D,MG3003511,Friend Materials,Institution him however inside law each.
200,E,MG5479660,Wall Materials,Series various really term loss hand campaign find cost prof
400,D,MG2646437,Box Materials,Green finally side decade.
400,D,MG4958017,Various Materials,Perform role represent job wrong lay cost red fact chance.
100,E,MG9331358,Like Materials,Worker moment visit method door cold.
100,E,MG5859861,In Materials,Impact detail happy give skill human society.
200,D,MG5950529,Find Materials,Drug contain analysis a tax.
100,E,MG9453444,Change Materials,Really tend production exist wear.
300,E,MG2378357,Account Materials,Six vote level realize difference state notice when huge coa
400,E,MG2308940,Threat Materials,Course easy out race hot owner standard.
400,E,MG4872334,Machine Materials,Past two many for.
100,E,MG3144916,Skin Materials,Finally seek garden off suddenly himself among watch practic
200,D,MG5663354,Television Materials,Opportunity visit region good young provide enter study thre
400,D,MG7364317,Challenge Materials,Center season likely happen affect hot rule majority action.
400,E,MG3202261,Whole Materials,Author money in enter early.
400,E,MG8890536,Age Materials,Economy various worry in wear.
400,D,MG4512877,Such Materials,Part take article firm magazine.
300,D,MG8390835,Garden Materials,Drop crime read by sound that church it rich major.
100,D,MG8041669,Possible Materials,Individual nor name decision power Democrat environment off 
400,E,MG9049157,Across Materials,Time current condition instead care figure.
300,D,MG5935169,Leader Materials,Political energy notice book player go ahead rich city happe
300,E,MG2806084,Best Materials,Church before our almost.
300,D,MG2849031,State Materials,Shake off successful kid after responsibility two soon arm s
300,D,MG9479418,High Materials,Establish now likely above relate since least despite.
400,E,MG9580224,Recent Materials,Follow personal form throughout career turn affect especiall
200,E,MG5015191,Maintain Materials,Many board evening back day never either surface close news.
400,E,MG4527132,Whose Materials,Both group goal affect type degree.
100,E,MG1469820,Image Materials,Relate bag arm actually material next.
200,D,MG4809811,Cause Materials,Sure raise teach left quite study herself tough.
100,E,MG3912223,Stand Materials,Staff word second rich list life by security turn street.
300,E,MG6242680,Tonight Materials,Writer form understand senior degree his owner.
400,D,MG9643536,Beyond Materials,Drop such mission message pick.
300,D,MG8597831,Never Materials,Firm guess father charge administration force two owner.
200,D,MG6944630,Network Materials,Quickly high sound him should easy system store maybe rememb
400,E,MG7769905,Change Materials,Loss purpose break public reflect teach community.
300,D,MG2364181,Former Materials,Field other defense beautiful trade international customer.
100,E,MG5715397,Image Materials,Industry all call task about pass.
300,E,MG8114899,Institution Material,Then campaign perhaps whatever material agree.
400,D,MG7513307,Energy Materials,Usually instead employee modern recent design.
200,D,MG1872370,Able Materials,Perform all tonight my hour.
400,D,MG9406631,Wait Materials,Control argue start evening majority name feeling.
300,E,MG9979596,History Materials,Character executive join administration rather between reali
300,E,MG4945709,Physical Materials,Law well first here lead.
200,D,MG1988888,When Materials,Public be no toward second ok sound.
400,D,MG4267510,Tree Materials,Practice threat sell management those candidate structure re
400,D,MG3966271,Store Materials,Fear enough article role according former anything natural w
400,D,MG9080641,Who Materials,Or result write total travel you ahead over.
200,D,MG6825529,Pass Materials,Better name nearly fall various parent rest likely hair gove
300,D,MG8126727,Newspaper Materials,During quite position scientist not great.
300,D,MG9239935,Character Materials,Detail house they big executive even step race.
100,E,MG9999253,Different Materials,Hard must lose knowledge little no popular idea coach.
400,D,MG8263426,Will Materials,Pattern reach fund executive this back accept.
100,D,MG4530067,Myself Materials,Bring special whom center green your change reality road des
400,E,MG2136976,Deal Materials,Above science wide probably remain international could eat o
300,E,MG9876634,Clearly Materials,Civil but one firm bar.
200,D,MG2589193,Long Materials,Feel green single rule best safe magazine newspaper director
200,D,MG3371738,Choose Materials,Ago happen look close ten former bring.
100,E,MG6661354,Plan Materials,Power federal green town moment unit billion too need field.
100,D,MG3559222,Lose Materials,Herself radio court foot move none.
400,E,MG9365137,Evidence Materials,Executive structure wrong notice sometimes only message.
200,E,MG1947675,Surface Materials,Bar condition what south can their wall institution.
100,D,MG1917976,Me Materials,Account front offer several along save you.
200,E,MG4751808,Build Materials,Admit hear enough speak eight contain.
100,E,MG6161528,Detail Materials,Century instead choice church however pay believe space chan
300,E,MG8346124,Law Materials,Half technology thing on candidate authority learn if head.
100,D,MG1663438,Down Materials,Life left letter arm bar.
200,E,MG6991728,Establish Materials,Because check mind affect PM else use.
400,E,MG9280427,Shake Materials,Away early hundred describe thought television nice environm
200,D,MG6280947,Debate Materials,Play worker catch new exist research woman serious.
300,D,MG8049990,Investment Materials,Certain nature personal from move million.
100,D,MG3032895,Boy Materials,Guess military who positive side teacher notice.
300,D,MG4966407,Meet Materials,Cut street hold crime major ability significant too.
200,E,MG9080113,Production Materials,Woman whatever any despite notice those would include white.
200,E,MG9018243,Responsibility Mater,Economic create treatment experience daughter how north prof
400,D,MG8957584,Difference Materials,Magazine my sound house soldier organization boy inside wide
200,E,MG5043744,Reveal Materials,Course option enough fine stage space.
400,E,MG9260490,Attention Materials,Wall beyond when ball culture election north player somethin
100,D,MG5232391,Out Materials,Course order international body I sit author identify always
400,E,MG7343071,Between Materials,May option who woman everything create data pretty sense suf
400,D,MG8678112,Beyond Materials,Tv anything agree model offer institution force strategy.
400,E,MG7145499,Begin Materials,Reach popular within during start business story police allo
400,E,MG6214388,What Materials,Age away including trade mission.
400,D,MG1809978,Write Materials,Service dinner throw even modern thousand serve.
100,E,MG9969957,Stock Materials,Notice society health school bad reality dream option includ
100,E,MG7424071,Around Materials,Real individual knowledge suddenly explain walk fly safe.
200,E,MG3766391,Throw Materials,Third hope whole property rise best standard arrive end soci
100,D,MG2911796,Budget Materials,Pay evening single teacher day economic charge part.
200,E,MG4710521,Seem Materials,Responsibility pressure party that push allow hear.
200,D,MG7805733,Evening Materials,Term range that power compare education whole great early.
300,D,MG6952006,Better Materials,Street final laugh collection admit eye article.
100,E,MG8346176,Number Materials,Huge market better organization radio become.
300,E,MG5783352,Top Materials,Hand staff on most international can story magazine open.
400,D,MG5761322,Far Materials,Seven production market office Republican body might however
300,D,MG3061929,Feel Materials,Spend create prove best top raise common home thing only.
300,E,MG9233058,Current Materials,Whose arrive practice be page everyone available.
100,E,MG5889432,Floor Materials,Else threat voice outside draw partner product she health cu
400,D,MG1210565,Career Materials,Television grow TV official kid.
200,D,MG1056886,Successful Materials,Left food back off country himself scientist control amount.
400,D,MG8026025,Goal Materials,Risk move kid question safe he.
200,D,MG4211606,Let Materials,Return position seem debate lose later.
100,D,MG8191608,Discuss Materials,Once space truth tax support single section year.
300,E,MG9782335,Choice Materials,Local right situation very agreement world first scientist.
400,E,MG2184023,Feeling Materials,History worker discuss attention material close democratic s
400,D,MG7361069,Color Materials,Feel agency game point enough fact wall structure.
200,D,MG5636112,Theory Materials,Message seven north size rock eye experience.
100,E,MG4399818,Thought Materials,Hair charge able activity set make evidence term me remember
300,D,MG8922695,Eye Materials,Institution cost give hot customer difficult.
300,D,MG3396617,True Materials,Decision art stand activity four Democrat sure clearly.
400,D,MG2361339,Them Materials,Final store trouble difficult off people ball beat understan
400,E,MG2098673,Reduce Materials,Degree outside purpose perform form hotel.
400,E,MG4351295,Couple Materials,Administration nature including clearly buy officer televisi
300,D,MG7060487,Strong Materials,People outside feeling unit example little party movement sa
300,E,MG6293597,Whatever Materials,Of material eye owner trouble.
100,E,MG3565123,Want Materials,Really food trial science win send both throw.
200,E,MG7441387,Mean Materials,Citizen accept own data.
400,E,MG4141508,Move Materials,Total budget door moment sell receive.
400,D,MG7797879,Mind Materials,Evening probably different rather issue trouble between befo
300,D,MG7110418,Until Materials,Either serious college figure agreement gas start environmen
100,E,MG2680952,Total Materials,Must example return ten then third.
400,E,MG6651760,Radio Materials,Owner full issue themselves newspaper dog.
100,E,MG6468579,Discover Materials,Drug theory risk them condition.
200,D,MG7893273,Color Materials,Begin key enough total total condition law place speech noth
100,D,MG2715321,Option Materials,Computer team site Democrat later suddenly story identify.
400,E,MG8724004,Through Materials,Smile word cost about window.
400,E,MG3083635,Child Materials,Law but real including dark situation national strong.
300,E,MG7810882,Face Materials,Heavy indicate instead alone chance report.
300,E,MG8486982,Activity Materials,After hour avoid bed federal happen challenge.
200,D,MG9717104,Rule Materials,Fish reality between later finish camera six.
300,D,MG7288566,Take Materials,Explain hair sort too pressure list probably per.
100,D,MG9819433,Size Materials,Hospital health officer realize sound.
200,D,MG6317041,Book Materials,Hand move ball southern with history real board fill.
300,D,MG5180886,Want Materials,Stuff until pressure together person.
400,E,MG1804921,Who Materials,Good far thing policy measure.
200,E,MG5056073,Government Materials,Front always spend development later tax east white view.
300,D,MG3471926,Region Materials,Home other need wear itself pattern recently night.
100,E,MG5882328,Skin Materials,Chance wear inside respond federal arm.
400,E,MG3371341,Woman Materials,Phone body from type.
300,E,MG7693535,Black Materials,Behind character test approach these national.
300,D,MG4271190,Indicate Materials,Drop specific especially national month size especially netw
400,D,MG5514467,Campaign Materials,Ask set career already here ever.
100,E,MG9460371,Low Materials,Today provide weight cold popular step avoid exactly.
200,E,MG3220790,Memory Materials,Speak doctor small smile others.
300,E,MG2416719,Many Materials,Environmental indeed available kitchen few interest also be 
400,D,MG1648947,Dog Materials,Continue will or financial there American degree decade.
400,D,MG4540258,Budget Materials,International upon early nation especially speech.
300,E,MG3083645,Sometimes Materials,Future subject top worry might fast this arrive modern.
200,D,MG1171923,Class Materials,Detail section number other fast born tough response bring.
100,E,MG5393450,Especially Materials,Audience my alone local plant amount.
200,D,MG3439705,Near Materials,Tree friend item where move television computer.
300,D,MG6061137,Lay Materials,Coach its politics major work drive medical protect.
100,D,MG2123309,Teach Materials,Father cultural according among send successful interesting 
300,E,MG1427323,Attention Materials,Imagine go act usually view activity top animal.
200,D,MG9648964,Full Materials,Deal each character offer film top school.
200,E,MG3177749,Floor Materials,Thank if national few face work.
300,E,MG3602725,Mr Materials,Religious police shoulder push just.
100,E,MG7632542,Teach Materials,Radio white create age.
400,E,MG2180107,Report Materials,Job authority many blood girl.
200,D,MG4572238,Crime Materials,Lay chance friend of born.
400,E,MG3153957,Though Materials,Turn must scene take hospital bank throw.
200,E,MG4270282,Major Materials,Catch field business test executive arrive every newspaper.
200,D,MG1835501,Relationship Materia,Dinner pull science herself always risk how.
400,E,MG2991474,Produce Materials,Wall number rule lose front statement wait general.
200,D,MG4673372,Threat Materials,Choose talk next tough draw fast bed.
200,E,MG7704128,Anything Materials,Ago cause young movie avoid.
100,E,MG2319161,Plant Materials,Investment raise list but stock great challenge owner decade
400,E,MG4889570,Partner Materials,Practice always official church every increase administratio
100,E,MG4500478,Serve Materials,Hope defense firm southern.
200,E,MG6534045,Leg Materials,Product anyone rule than kid adult exactly within age scene.
100,D,MG3017476,Affect Materials,Visit pull tax per indeed board.
400,E,MG9536557,Method Materials,Party performance few give message stage.
200,D,MG5570890,Factor Materials,My along south form base position hospital born thousand com
100,E,MG4622406,Design Materials,To sure money point month provide.
400,D,MG7865181,So Materials,Single would analysis PM partner indicate.
300,E,MG4852372,Writer Materials,His feel image bill player way least.
300,E,MG4653025,South Materials,Space bill peace instead oil play rate by.
300,D,MG6000786,Base Materials,Western language let particular agency guess.
200,E,MG6005623,Instead Materials,Leave series education boy mind.
200,D,MG3346720,Attack Materials,Let true every arrive head picture.
300,D,MG8433663,Summer Materials,Reveal where capital lawyer president down.
400,E,MG7667973,Authority Materials,Investment in general sure reveal although number property s
200,D,MG7700299,Or Materials,Every town light will into determine.
400,E,MG5941906,Week Materials,Beat significant wide parent any.
200,D,MG7451801,Account Materials,Far close environment dinner unit finish kitchen.
400,E,MG8686258,Congress Materials,Style safe thus step rise.
100,D,MG3047404,Window Materials,Hard case cut security weight know young.
100,D,MG6411761,Part Materials,Ground heart less real book build majority.
100,E,MG6532954,Accept Materials,Without page detail leader middle player picture occur.
400,E,MG8455333,Class Materials,Off Mrs meeting field bank actually us miss movement.
300,D,MG5965599,Wife Materials,Site get manager deep eye.
200,E,MG5252592,Enter Materials,They music able local magazine hotel act.
100,E,MG4195827,Level Materials,Whatever join debate something throughout.
400,E,MG4938656,Land Materials,Find sit theory none doctor song.
200,D,MG6104291,Occur Materials,Those benefit necessary appear when.
200,D,MG5629286,Authority Materials,Mean police although relate form music opportunity scientist
300,E,MG4850294,Back Materials,Congress director huge together rather degree.
200,D,MG3243565,Under Materials,Hear always education clear feeling.
400,D,MG2371497,Seven Materials,Dinner where style test prevent he national.
300,E,MG2605367,Until Materials,Responsibility ball beautiful tree kind effect defense board
100,D,MG6115338,Box Materials,Cover decide admit entire other seek.
200,D,MG1160819,Brother Materials,Run great other want network laugh age I unit tough.
100,E,MG2791032,Arrive Materials,Its sound develop certainly teach society someone event west
400,D,MG1685493,Project Materials,Market recently protect commercial recent admit serve.
200,E,MG7285895,Summer Materials,Know unit attack nor store us.
100,D,MG7600420,Manager Materials,Throughout strong major seat probably president floor bed.
200,D,MG9111017,Place Materials,Learn safe until create support.
400,E,MG9126574,Follow Materials,Artist everything open phone even approach foreign quickly d
200,D,MG2557692,Poor Materials,Process prevent for customer office audience everybody visit
100,E,MG7341983,Almost Materials,Quickly bring which people allow chair.
100,E,MG5874617,Financial Materials,Game particular player apply enough current actually sign.
300,D,MG7934119,Rise Materials,Think alone crime along evidence important oil prepare.
400,E,MG6585609,Attorney Materials,Growth analysis plan major seek industry easy tax sister sho
300,E,MG7922975,Middle Materials,Develop simply rock according result.
400,D,MG8467279,Professional Materia,Represent build truth most.
200,D,MG6232679,Television Materials,Difference quickly book matter turn all rule.
300,E,MG2666966,Might Materials,Quickly himself glass fish city no decade north.
400,E,MG9105886,Audience Materials,Soon spring pressure particular south.
300,D,MG8602986,Eat Materials,Strategy away hit control them really bag.
100,D,MG3392750,Example Materials,Military prove magazine late dark case when size young worry
200,D,MG9687086,Stop Materials,Former my family no.
400,D,MG8598671,Art Materials,Could air data example property model hit to help three.
400,D,MG1958516,Drive Materials,Some him price television chance majority big wrong consumer
400,D,MG8081072,Safe Materials,Artist serious sense year can your wait.
100,D,MG6050532,Job Materials,Only store cost PM lead.
300,D,MG5640143,Sit Materials,Cup impact quite purpose myself open law exist.
400,D,MG5073382,Oil Materials,Loss seem realize century do wear.
300,D,MG2602969,Song Materials,Child develop American clear international while way thus ag
300,E,MG8779856,Challenge Materials,Sign dinner benefit no than indeed professional summer case 
100,E,MG2406912,This Materials,Vote put pull friend time pick.
400,E,MG1226896,Give Materials,Management ball price fast ago.
300,E,MG6170563,Board Materials,Job meet board accept tell guy more more.
100,E,MG3340380,Color Materials,Program support other back American research product must la
100,E,MG6259863,Political Materials,Those list by name free.
200,D,MG7148487,Mention Materials,Account his indeed lot weight.
300,D,MG6182209,What Materials,Daughter south long late suggest.
200,E,MG9501035,Yeah Materials,Sister century imagine buy early.
200,D,MG1193293,Speech Materials,Top read TV record view sit.
200,E,MG2908407,Miss Materials,Return finally art sense fund without specific nation.
400,D,MG3714741,Upon Materials,Set however financial ever need man else.
400,D,MG7734075,Study Materials,Miss involve toward onto level turn meet.
300,E,MG1355239,Buy Materials,Ahead bed thus positive herself onto.
400,D,MG2518719,Model Materials,Several bar bank authority line hair.
200,D,MG4157885,Finish Materials,Ok bill off experience what our soon.
300,D,MG9779166,Treat Materials,Mention establish whom unit around show so guess skill.
