200,E,MG6558104,Reflect Materials,Young candidate become far discuss manage matter news world.
400,E,MG3769938,Of Materials,Memory while high early economy stop debate military.
400,D,MG4486685,North Materials,Human impact director several interest happen customer state
300,D,MG9136115,Report Materials,Usually get season happy avoid happen.
300,E,MG3851097,Future Materials,Billion least exactly data short.
300,D,MG9779690,Mind Materials,Low treatment change in there born room how forward.
200,D,MG9396686,Early Materials,Should nor method different top police.
400,E,MG8152362,Listen Materials,Life spring challenge poor new others suddenly.
400,E,MG6674844,Nothing Materials,Yet crime skin memory discuss good everybody player culture.
100,E,MG2252079,Or Materials,Scientist also what off full prevent.
200,E,MG2508465,Throughout Materials,Away church Democrat yes sure sit human military about.
400,D,MG4103556,Result Materials,Inside between already poor particular five purpose.
100,D,MG3430305,Agent Materials,Up wear no bill policy radio front purpose.
200,E,MG6249453,Letter Materials,Require become according various song nor behind seven relat
100,E,MG3728029,Traditional Material,Wear her theory reach ready person ask you.
200,D,MG1955188,Perhaps Materials,Clearly wear because human method authority east.
200,D,MG8285885,Bill Materials,Wife technology onto thank account low real yeah.
200,E,MG6516384,Second Materials,Imagine floor perform send full role.
400,E,MG8342181,Director Materials,Positive country major market concern myself wear.
200,D,MG7565914,Party Materials,Unit war suggest key project sure back no full.
100,E,MG8453322,Consumer Materials,Increase easy law child investment fish appear.
200,D,MG5059517,Already Materials,Six remain speak such health fly station.
200,D,MG9168977,Choice Materials,Finally traditional reach member five property.
400,E,MG2431275,Hour Materials,Tv business cause toward note oil present have.
400,D,MG2512527,Matter Materials,Major lose three social top girl long source.
400,E,MG7118417,Buy Materials,Situation forget new whom development low language list live
100,D,MG9459776,Expert Materials,Air star assume reflect decide arrive material father.
300,E,MG9333872,Off Materials,Music focus air response decision after.
200,E,MG5003879,Event Materials,Partner get television apply vote woman.
100,D,MG2970407,Choice Materials,Represent partner suggest sea trouble kind current.
100,D,MG1099217,Source Materials,Prepare show focus pick general again arm issue war difficul
400,E,MG3384803,Sound Materials,Manage keep between language strong.
400,D,MG6049762,Their Materials,Mind middle whole plan upon respond term suffer.
200,D,MG6366681,East Materials,Change start by bring standard drug perform season.
400,E,MG6477797,Stage Materials,Major college research answer despite town visit carry list 
400,E,MG1414536,Region Materials,Assume agreement at event ready guess still.
400,E,MG4156122,Tonight Materials,Step their discover poor light several.
400,D,MG3100520,Else Materials,Discussion staff education through here early.
100,E,MG9647785,Paper Materials,Know country everything mind physical memory meet top day pr
300,D,MG3321414,Until Materials,Year certain these personal money son hair during environmen
100,D,MG1564653,Inside Materials,Door fill value public run ok of born family.
100,D,MG1549120,Recent Materials,Myself late participant staff leave should.
300,D,MG1213337,Trial Materials,Century child despite blood police success thing.
200,E,MG4361656,Budget Materials,Court investment organization garden the anything fear let u
400,D,MG4204530,Green Materials,Hot sign all dark sister mean although meet memory.
400,E,MG4774651,Exactly Materials,Process civil represent approach develop sit military Mrs ch
200,D,MG9186573,Door Materials,Land sometimes though ask into agency a next television.
400,D,MG5354215,Bank Materials,Religious life yeah that edge month respond Mr.
400,D,MG8649227,While Materials,Speak whether language protect reach mission onto indeed.
100,E,MG6685025,Sometimes Materials,Focus data television wind sell himself popular.
300,D,MG1467045,Join Materials,Weight bring inside behind federal ask cost painting.
100,D,MG5009590,Machine Materials,Evening she whose perform wrong close view.
100,E,MG6986666,Your Materials,Mouth why case ability.
400,D,MG7196429,Project Materials,Health necessary policy available cold president experience 
200,D,MG6204844,Get Materials,Late president former few buy none.
300,D,MG4767214,Prevent Materials,Church method under key test lead yes film.
100,D,MG8863616,Any Materials,Year program compare four doctor bank.
400,E,MG5886720,Various Materials,Inside medical attention man assume medical style.
400,E,MG5329369,Professor Materials,Investment bill plant boy team until herself car evening.
200,D,MG5260408,Quite Materials,Woman least occur yard they seek eat.
300,E,MG5005534,Design Materials,Main single deep sense growth hold.
200,D,MG9432204,Wrong Materials,State language building house huge few laugh law.
300,D,MG1873092,Professor Materials,Today speak condition energy walk war.
400,D,MG5717579,Range Materials,Full music he professional bill letter write chair.
200,D,MG8679311,Itself Materials,Consider college population improve perhaps at message colle
400,D,MG3517933,Population Materials,Current memory seven image field away north.
300,D,MG9446666,Effort Materials,Public win attack evening team.
100,D,MG6771274,Contain Materials,Field three total stock first local before.
200,D,MG5550993,Base Materials,Someone environmental character ago very six feeling entire 
200,D,MG2006372,Number Materials,Nothing land several catch common statement vote.
100,E,MG7739690,Free Materials,Drop run such all house.
100,D,MG8863316,Sound Materials,Day seven sing possible product its ever music quite office.
400,E,MG5757328,Write Materials,Call any there sound.
400,E,MG8086585,Serve Materials,Build candidate above suggest stock address probably decade.
300,E,MG6328843,Whether Materials,Increase your by popular even character audience while ready
300,E,MG1663363,Two Materials,Administration might hope simply candidate community.
100,E,MG4319899,Although Materials,Pay same choose like international event common carry space 
400,E,MG2543099,Entire Materials,Positive bar candidate outside return officer PM.
300,E,MG5344068,Able Materials,Now eye do mind well.
400,E,MG3531390,Economy Materials,Any public data report build fear yeah up term.
200,D,MG1119705,Land Materials,Candidate either letter four side able provide ever model.
100,E,MG6645070,Light Materials,Customer family page reflect why figure lose item resource.
300,D,MG1979388,Work Materials,Worker us relationship tend poor test.
400,D,MG8633707,Over Materials,West benefit sea develop remain from treat responsibility el
200,E,MG4036200,Economy Materials,Ever despite effect crime but culture team southern responsi
100,E,MG7960263,Bank Materials,Mouth individual result same position maintain.
300,E,MG1778098,School Materials,Soon site cover light over woman approach prepare article la
200,E,MG7730841,General Materials,Support trade red specific pretty.
100,E,MG7430384,Suffer Materials,Example education heart at different now season yard.
400,E,MG5304400,Evidence Materials,Return whether senior dinner however guy road baby.
200,D,MG9794255,Left Materials,Throw live up agent question begin.
400,D,MG1958935,Act Materials,Left piece stock establish network dog realize.
200,E,MG3560836,Trial Materials,Senior base unit accept represent TV firm.
200,E,MG5292636,Run Materials,Look enter say play civil series ago director.
300,E,MG7385221,Citizen Materials,Economic fast defense scientist family example bank always p
100,D,MG3315012,Suggest Materials,Decide every financial assume picture song should prevent.
400,E,MG6395252,Result Materials,Month side room do yourself team everyone benefit writer.
400,D,MG2483092,Sit Materials,Hotel second generation born nice set less have.
200,E,MG6798505,Remember Materials,To weight read ability middle hand operation almost skill to
200,E,MG9860191,Word Materials,Process help never security onto continue reduce most crime 
100,D,MG9743245,Hand Materials,Member society all enter ability amount.
400,D,MG4029268,Bring Materials,Develop represent development phone go.
200,E,MG3400159,Something Materials,Operation economic still position sell she night exactly pay
300,D,MG7755287,Out Materials,Himself throughout something discover democratic.
200,E,MG9084493,Family Materials,Issue should course fast admit hope.
400,D,MG9297225,Simple Materials,Western election course what public growth.
200,E,MG6604004,Lead Materials,Plan benefit should adult around film.
300,E,MG3941916,Take Materials,Head seven network record hear security.
200,D,MG3452056,Occur Materials,Necessary write natural agent turn.
300,D,MG3918205,Degree Materials,Use physical have soon.
200,E,MG7333889,Art Materials,Modern professional white draw mention tonight general train
400,D,MG8419650,Movement Materials,International hear successful director.
200,D,MG3868774,Despite Materials,Reality order call contain body citizen soon rich stuff offi
200,E,MG7320647,Song Materials,Production operation hold skill fine as base.
300,E,MG8319577,Cold Materials,Sense Mr actually style show.
200,D,MG9411835,Example Materials,Sense month him arm reveal customer note clear daughter do.
300,E,MG5933191,Off Materials,Worker hair stock issue across attention.
200,D,MG1561530,Safe Materials,Back whom entire believe already health like.
100,E,MG3399396,East Materials,Include per team forget gas dark take put enjoy woman.
400,E,MG7636264,Early Materials,Like fish inside media nearly Republican crime ball.
200,D,MG5963235,Blue Materials,Style beyond force responsibility remain.
400,D,MG4856633,Fill Materials,Stuff per ready foreign behind leave.
300,D,MG9587863,West Materials,Learn though suggest loss explain race each specific drive.
100,E,MG5212699,Pull Materials,Drug later share though investment that treat employee grow 
200,D,MG7356938,Box Materials,Similar standard he size civil perhaps respond nearly do may
300,E,MG6609856,Subject Materials,Door many record how number property others may sense machin
100,E,MG5359519,Forward Materials,Old reveal worry on prove despite follow toward.
100,E,MG9875965,Fill Materials,Huge knowledge our Mr me involve customer authority.
400,E,MG5157233,Manage Materials,Begin take anyone without describe cultural authority sectio
100,E,MG3473071,Adult Materials,Seven threat child agent red add coach certain.
300,D,MG1229481,Newspaper Materials,Bar quickly people left least many.
300,D,MG2096828,Work Materials,People quite reality middle remember half hard use also with
400,E,MG8948839,Those Materials,Miss most large likely cause democratic do serve.
100,D,MG5772523,Congress Materials,Treat want daughter short class cause line court dog young.
400,E,MG2503908,Size Materials,Century base land student you fast gun process.
200,D,MG8231399,Other Materials,Charge trip affect else page arrive whom senior.
200,D,MG9289742,Sometimes Materials,Head we financial produce that attention business.
300,D,MG9037150,Century Materials,Even other design friend face forward call safe.
100,E,MG2098709,Brother Materials,Culture religious once too benefit technology now blue sure 
100,D,MG2944672,Take Materials,Wrong anything vote final hair hear voice pretty month.
300,D,MG5861636,Task Materials,Mr arrive pattern ever make fund teacher.
300,D,MG5393010,Stop Materials,Think write pattern west green.
400,D,MG8029382,Weight Materials,More blood treat easy whole term.
400,D,MG8804321,Health Materials,Fly age official and in including safe smile sport.
400,E,MG5895204,Begin Materials,Interesting now where second arrive page ask design own heal
100,D,MG5586045,Similar Materials,Economic pass want yet western war treat.
300,D,MG8272020,Center Materials,Side seek director knowledge trip candidate hit.
200,D,MG6662144,Others Materials,Size drop recent clear both difficult lay.
200,E,MG1192627,Should Materials,Talk feel we husband fast could how series next call seat.
300,D,MG4906423,Unit Materials,Company ask ready heavy discover talk stay look company righ
100,E,MG9686902,Sound Materials,View station technology history finish bit.
100,D,MG8540629,Save Materials,As however these quality much finish its either.
100,E,MG4565339,At Materials,Dog state stop home after worker.
200,E,MG1279550,Dark Materials,School hair practice town skill democratic three human it ea
400,E,MG9137970,Our Materials,If surface west project these church middle.
400,D,MG9992245,Culture Materials,Right long very political personal reach forget think curren
300,D,MG1691917,Clearly Materials,Without who entire guess of player business role sometimes.
300,D,MG8136392,Manage Materials,Interview probably could fall tonight goal education western
200,D,MG6181239,Knowledge Materials,West land your anyone.
100,D,MG6135254,Ask Materials,Tonight rule also seek say choice involve agent just.
100,E,MG2673122,Political Materials,International chair rule lawyer floor.
400,D,MG9738089,Our Materials,Much onto result appear back.
300,E,MG5442948,Wish Materials,Question level part talk finish fill cold hard teach growth.
300,E,MG2825084,Hard Materials,Commercial recently west challenge program gun benefit us co
200,E,MG7900918,Discuss Materials,Mouth beyond face eat score according.
100,E,MG8336137,During Materials,Measure within your chair build education hair.
100,E,MG2786694,Thus Materials,Strong military wall class plan both up part skill.
300,E,MG5886814,Hotel Materials,Decide another manager environment may professional age.
100,D,MG4542855,Great Materials,Job kitchen pick around where upon learn address quite.
200,E,MG4364575,Simple Materials,Method save kind also indeed build investment.
100,E,MG9476005,Clearly Materials,Situation fast loss build relate bad cold follow.
100,E,MG8678104,Be Materials,Sometimes thousand development know can smile.
300,E,MG3497335,Marriage Materials,Dark economy behind bill car whether push another structure.
400,D,MG1092378,Quite Materials,During time maintain worker manager chance option hair.
200,D,MG2075367,Executive Materials,Decision expert organization clearly financial radio couple 
200,D,MG6055594,But Materials,Major none choice fill contain since lead.
400,E,MG5491172,Within Materials,Possible drug science body cup.
400,D,MG7674407,School Materials,Represent even might probably bill.
200,D,MG5327589,Beat Materials,Current be amount small our either leader indeed.
200,E,MG5084252,Win Materials,General either project eight affect.
300,E,MG4023567,Need Materials,Six pick summer school sea various.
400,D,MG8819102,Music Materials,Purpose live front career figure expert.
400,E,MG5024499,Even Materials,On whether perhaps crime both.
200,D,MG4036088,Should Materials,Campaign whether security college large pattern blue listen.
200,E,MG2061726,Catch Materials,Read professor smile control return stay girl city.
100,E,MG5380939,Card Materials,Region this glass fund city least reason us operation wide.
400,E,MG6697708,Before Materials,Race approach product center wall nearly.
300,D,MG7241332,According Materials,Chance think determine health better talk five impact write.
100,E,MG2403495,Voice Materials,Entire foreign too high hear firm.
400,D,MG2707311,Person Materials,Sort mean democratic put quickly Democrat.
100,D,MG7574344,Power Materials,Usually over figure good easy quality involve car.
300,D,MG4484896,Money Materials,Sport day join time get.
400,E,MG1804313,Gas Materials,Government play before available surface word himself affect
200,D,MG7462274,Deep Materials,Choose cultural newspaper voice those.
400,E,MG2976762,Individual Materials,Next clear past area thought.
400,E,MG4488682,Late Materials,Movement have customer office production southern point spri
200,E,MG9402387,Dark Materials,Article themselves ahead key however meeting.
200,D,MG2376098,Finally Materials,Seven rich discussion program drug base accept.
300,E,MG9369823,Project Materials,Force research change six after entire.
400,E,MG3589982,Station Materials,Give arrive human choice participant list forward house.
100,E,MG3005637,Miss Materials,Father third staff ready today say smile.
200,E,MG1337542,Charge Materials,Charge fund leader method too agent indeed.
100,E,MG7269239,Move Materials,Experience upon teach into easy some country fast time Repub
200,D,MG3633773,Message Materials,History arm head gas thousand official.
300,D,MG9749794,Full Materials,Idea soon star personal admit hold government management tes
100,E,MG4861587,Because Materials,Top article open with gun husband more hit.
300,D,MG5971013,Million Materials,Learn year truth bit bring.
100,D,MG6423905,Recently Materials,Travel south wait exist citizen.
100,E,MG8255714,Majority Materials,Personal buy southern behavior international decade individu
100,D,MG9763426,Maybe Materials,Because purpose attorney medical mouth.
300,D,MG1244703,Guess Materials,Food might defense may when.
300,E,MG1902913,Argue Materials,Cause rate bring hour area person manager front do week.
100,D,MG1444206,Husband Materials,Suggest rate fly conference school success second style even
200,E,MG7820398,Court Materials,Visit alone after free as whose without seat prepare.
100,D,MG8771567,Organization Materia,Who a pick question middle rest operation staff head off.
400,E,MG4334788,Product Materials,Theory serve often yet consider blue affect former ground.
100,D,MG6461800,Material Materials,Little hold alone hand able activity.
400,D,MG6765603,Both Materials,Person want car class course something would.
400,E,MG8378886,Stand Materials,Several stuff red plan miss say actually ahead Congress.
100,D,MG3394716,Million Materials,Weight letter bag relationship note tree watch decade page f
400,E,MG9520493,List Materials,Top wall but piece realize address conference.
200,E,MG8325874,Hotel Materials,National authority personal age worker begin give each what.
100,D,MG9081941,Oil Materials,Investment different another to remember peace compare three
100,D,MG1471180,Own Materials,Represent shoulder wonder late entire coach.
300,D,MG1513837,Specific Materials,Evidence operation Mr reality road discussion black.
100,E,MG3687549,Hold Materials,Population air stay property country live summer.
200,E,MG2506030,Care Materials,Mind friend whose thought nice road.
100,D,MG4521101,Pattern Materials,Music out available subject community.
300,D,MG1367722,Long Materials,Now unit everyone beyond win back occur.
200,D,MG3424241,Whatever Materials,Per I our head stock Republican.
200,D,MG1485387,Believe Materials,Middle surface she rule relationship pattern.
300,E,MG2438197,These Materials,Exist policy yourself close be present.
400,D,MG9717340,Save Materials,Drop certainly six discuss rest.
100,E,MG9418724,Provide Materials,Particular join cut left center chair.
100,D,MG6774672,While Materials,Rise though stage toward prepare poor pressure difference.
300,E,MG3927757,Need Materials,Several toward decade number field apply.
200,E,MG6527271,Project Materials,Plan bring face side source modern.
200,E,MG3357344,Imagine Materials,Ball school decision fish place father.
300,E,MG2239315,What Materials,Light alone great third.
400,D,MG8550421,Level Materials,Whole future however smile general break far plant.
100,D,MG6538092,Everyone Materials,Edge ago modern way deal.
300,E,MG9125476,Because Materials,Child less anyone brother present him.
200,D,MG6060283,Very Materials,Concern develop Republican deep involve oil.
400,D,MG5875141,Play Materials,Wonder my answer military morning clear.
400,E,MG6125409,Task Materials,Benefit than look prove cup gas.
400,D,MG9501886,Build Materials,Career itself natural go professional class measure them.
300,E,MG1214781,Get Materials,Professional among war especially like.
200,D,MG1345350,Class Materials,Director agent you trial include.
300,E,MG6446085,Address Materials,Data outside senior Republican mother rule rich lot.
300,D,MG6881290,Student Materials,Anyone physical page serious yes expect four training add.
200,E,MG7097002,About Materials,Both dream seem computer apply to second study model win.
100,E,MG8803558,Article Materials,Southern trip who within newspaper success.
100,E,MG5600049,Out Materials,South room development nation animal name war movie away poo
400,E,MG1672354,Film Materials,Color minute east trial.
300,E,MG7892928,Similar Materials,Parent stand data seem democratic build environmental skill 
200,D,MG2133930,Election Materials,Ten beyond pattern push at picture responsibility enjoy law 
300,D,MG6957374,Local Materials,Support what movie standard order wish.
200,E,MG5951728,Bank Materials,Condition option write case piece wonder change war.
400,E,MG7703629,Able Materials,Others determine early may.
100,E,MG3618775,Home Materials,War white food pull position several prove.
400,D,MG8301998,Six Materials,Avoid market everybody step whose to morning paper.
100,D,MG1927284,Process Materials,Anything middle company think growth various.
400,D,MG1926326,Care Materials,Country same tree eye these amount officer.
300,D,MG2253689,Place Materials,Month to bad artist everybody later just year.
400,E,MG9418395,Seem Materials,Or city finish standard almost compare page.
200,E,MG4470864,Around Materials,Blood course maintain population manager across state heavy.
300,E,MG1074353,Physical Materials,Stock second movement answer door.
200,D,MG4743788,Left Materials,Lay natural huge bill civil but.
300,D,MG7517057,Hour Materials,Include their notice standard year soon read magazine talk s
300,D,MG4606948,Yeah Materials,Meeting hot ago article firm meeting degree necessary.
300,D,MG6477582,Store Materials,Same impact building role decide marriage loss modern profes
400,E,MG2809520,Hear Materials,Difficult easy social whether difficult radio I.
200,E,MG5044940,Forget Materials,Else point better fly issue.
400,D,MG3310302,Figure Materials,House service move girl yet.
200,D,MG4053378,Huge Materials,Miss use discover leader Democrat federal executive.
100,D,MG2444200,Never Materials,Speech hundred our sort board president.
100,D,MG8999635,Rest Materials,Address attack task pretty sit bad parent scene.
400,D,MG1238393,Place Materials,Knowledge fund born government next store modern.
300,E,MG7413676,Remain Materials,Benefit analysis before require of station Democrat tax expl
300,D,MG7608576,Gun Materials,Knowledge here good from after plant best source item.
200,D,MG3542040,Drop Materials,Research learn decide join career care amount his foreign pu
100,D,MG6654549,Continue Materials,Son bit compare memory reach.
100,D,MG1877056,South Materials,Above collection will town not.
300,E,MG5970297,Discuss Materials,Sit nothing probably certainly nation job recently player su
100,E,MG1760556,Last Materials,Particular data chair record focus down allow financial do.
100,D,MG9238073,Cold Materials,Everyone down develop light million question model reflect e
300,D,MG5290477,Foot Materials,Join student behavior total pick environmental loss.
100,D,MG6955302,Kid Materials,Sound stock particular someone discover wish officer person 
100,E,MG9662915,Choice Materials,Pull draw every number price fund place great.
100,E,MG8126043,Book Materials,Turn instead center drive police full ask over writer enter.
200,E,MG4072481,Mrs Materials,Interview week realize member world talk half benefit.
200,E,MG8943492,Support Materials,Speak responsibility same finish behavior sometimes.
100,E,MG8950841,Itself Materials,Try story message where hand serve individual none.
200,E,MG8705980,Father Materials,Law none test put pass message cultural require enough.
200,D,MG3958778,Dream Materials,Design control win home exist.
100,E,MG8048144,Economic Materials,Agree four job develop less skin front team fill.
400,D,MG9015741,Face Materials,Exist world much determine nothing less.
100,D,MG7385345,Like Materials,Leave seven audience worker meeting.
100,E,MG9447972,Commercial Materials,Direction beautiful care law strategy consumer television th
200,D,MG3627196,Tend Materials,Which wide dinner three why even smile consider ago health.
400,E,MG6772643,Sister Materials,Produce phone various already particularly begin.
200,E,MG8882672,Much Materials,Expert responsibility question myself technology person work
200,D,MG7505007,Along Materials,Wonder quality cup to face name.
200,D,MG4907414,Provide Materials,Nice sell daughter onto total season state note word she.
400,D,MG7652167,Task Materials,Purpose cold chair morning.
300,E,MG1755010,Conference Materials,Pull society loss walk evidence onto set activity particular
300,E,MG4455811,But Materials,Office dark effect lead rate seek attack inside common simpl
100,E,MG4922666,Most Materials,A home way be million explain picture TV usually.
200,D,MG1789724,Next Materials,Environmental someone technology worker customer new clearly
100,D,MG9662753,Administration Mater,Wonder teacher federal little establish.
300,E,MG9354084,Return Materials,Budget military around close finally professional property s
300,D,MG1120445,Discover Materials,Technology single including modern push gas process.
200,D,MG9498893,Knowledge Materials,Pressure identify car home smile term.
400,D,MG7881988,Court Materials,A various in truth meet serve.
400,D,MG9332550,Community Materials,Activity national structure last program back tell eat glass
100,D,MG9616231,Skin Materials,Practice today current reach prevent piece write after campa
400,E,MG2508743,Behavior Materials,Piece appear gas heavy size person science day.
200,E,MG3689123,Believe Materials,Between whom try report really red feel drop direction elect
200,D,MG1366529,Happy Materials,Always coach indicate able require.
400,D,MG7944896,Method Materials,Star western left site great talk outside throughout school.
200,E,MG4593084,Gas Materials,Stage man official role know although actually.
