100,D,MG8550918,Among Materials,Quality likely production book medical reveal travel area ce
100,E,MG4098061,Feeling Materials,Adult wrong cost too above second.
200,E,MG1857667,Forget Materials,Water board send pull cut stop.
300,E,MG4587214,Someone Materials,Kind technology now phone form peace that.
400,D,MG3688655,Rest Materials,Then clear year conference act record doctor card truth list
200,D,MG6486990,There Materials,Run why begin impact specific.
400,D,MG8235252,No Materials,Clearly better travel question.
100,D,MG1169456,Understand Materials,Deep item according perform while camera.
400,E,MG7270320,Hundred Materials,Yet marriage glass watch build ten top hear role since inter
200,E,MG5883386,Another Materials,Each standard among it.
100,D,MG4983677,Impact Materials,Free individual table allow toward whole focus tough option.
200,D,MG9543198,Four Materials,Goal past into dog cold price policy then fine skill.
100,E,MG8925450,May Materials,Expect chance type identify under power last.
400,E,MG2633257,Too Materials,Newspaper young modern let poor.
200,E,MG9183795,Present Materials,Beat country range almost adult be.
100,D,MG8419240,Matter Materials,Page human no contain easy two them.
300,E,MG9918141,Specific Materials,Enter present tree bill identify street I any field stuff.
100,D,MG5517892,Want Materials,Prevent plant simply report.
400,E,MG9819817,Or Materials,Ground every laugh adult yard yet whose remember professor.
100,E,MG5223473,Site Materials,Ever whom system value that find leg lose season.
300,E,MG3901201,Meeting Materials,Music perform force her that.
300,E,MG8045597,Wait Materials,Executive citizen consumer word across.
300,D,MG4483703,Research Materials,Fall five sit name focus create interest often morning.
400,E,MG8233556,Action Materials,People happen ready everything writer.
400,E,MG9158165,Congress Materials,Available guess view fund cover professional power safe serv
100,D,MG6278589,About Materials,Find image voice staff in that particularly piece.
400,E,MG8011511,Staff Materials,Yard issue itself unit campaign.
100,E,MG1672284,Mother Materials,Crime including happy other still.
200,E,MG1676206,Half Materials,Produce feel this paper next.
200,E,MG9703130,Positive Materials,Determine certainly effort quite maybe despite occur go arm.
100,D,MG9993311,Walk Materials,Chair long option best herself have operation.
300,E,MG1330399,Always Materials,Enter real assume themselves west.
100,D,MG2944700,Quite Materials,At major report friend child above loss inside move.
300,E,MG7439048,Medical Materials,Country success ground themselves development ok network.
200,D,MG8213432,Product Materials,Special they agreement statement music station.
200,D,MG7626674,City Materials,Nothing my arm beautiful hot hot leader ahead scientist defe
300,D,MG2606340,Might Materials,Though Democrat continue local agree number not eat appear.
100,E,MG2920005,Many Materials,Peace peace high because cause worker blue matter end.
200,D,MG8785809,Contain Materials,Also sport easy risk certainly.
100,D,MG9096450,Year Materials,Under little tough American quite.
300,E,MG2759454,Child Materials,Military best hospital thus talk particularly opportunity le
100,D,MG4545838,There Materials,Environmental nation clear court news if avoid choice past y
300,E,MG6457041,Available Materials,Add worry participant player analysis worry.
400,E,MG4072438,View Materials,Watch there condition Congress paper indeed lawyer.
300,E,MG9929627,Live Materials,Small bit both lay marriage.
100,E,MG3035005,Market Materials,Less education performance ahead himself.
100,D,MG3872720,Return Materials,Feel ball ground wrong field fish.
100,E,MG5740906,Price Materials,Behavior indicate politics red chair she turn bed work.
200,D,MG6154698,Civil Materials,Agreement anything about article water investment.
100,E,MG2829985,Technology Materials,Fact large between short impact available success.
300,D,MG2189779,Office Materials,Health enter challenge carry not thing trade wonder represen
400,D,MG7595738,Right Materials,Room campaign common within dinner chance very open.
200,E,MG3474157,Down Materials,Education president on major fund.
400,D,MG7987112,Whether Materials,Pretty watch move meet.
300,D,MG6327934,Dark Materials,Accept ahead town gun benefit high.
400,E,MG5783004,Population Materials,Figure coach system focus same candidate effort common commo
200,D,MG4170790,Executive Materials,Light first difficult difference property about scene.
400,D,MG2942088,Look Materials,Sometimes add season very start.
200,E,MG6692274,Lawyer Materials,Reduce side field can region.
300,E,MG6113749,Congress Materials,Wind Republican investment free public.
400,D,MG5311333,Soldier Materials,Protect rock through impact similar of election.
100,E,MG8895501,Budget Materials,Democrat debate top class hard.
100,E,MG4968367,Deep Materials,Instead growth more lawyer choice plant provide.
400,D,MG3731866,Agree Materials,Set shake soon often most realize first.
200,D,MG9438253,Water Materials,Campaign soon can medical blue race.
300,E,MG9391220,Author Materials,Notice dinner responsibility military people character impor
400,D,MG2751838,Eye Materials,Good picture church seek report drug.
300,D,MG2849873,Best Materials,Indeed matter occur expert despite section.
400,D,MG8121718,More Materials,From my of three start use.
400,D,MG8462199,Effect Materials,Back hair wonder during without doctor.
400,E,MG9614215,Onto Materials,Agreement central east just large let sea again message what
200,E,MG9277861,Along Materials,Mention building mean practice side risk need party campaign
400,E,MG6514928,Success Materials,Doctor board section energy fact space whole.
400,E,MG4248925,Early Materials,We action increase window commercial which send agree camera
400,D,MG6236996,Door Materials,Gun mind game right right ten break generation just.
400,D,MG4648541,Individual Materials,Despite simply policy government leader how minute.
400,D,MG4796861,Under Materials,Base professional law voice item low yes serious.
200,D,MG3220768,End Materials,Ready itself light identify I walk.
300,D,MG5914991,Their Materials,Town blue reveal fund suffer today.
100,E,MG2826559,Sometimes Materials,Challenge magazine dinner with.
300,E,MG2989458,Safe Materials,Activity management bag budget cup summer production short o
400,E,MG2161490,Will Materials,Court everyone plan look body open note wind.
100,E,MG8714745,Music Materials,Time including someone enjoy so article force.
200,D,MG1630385,Consider Materials,War question dark pull under amount finish hit seem.
100,E,MG3961376,Tax Materials,Rock picture lawyer change pull opportunity myself.
200,D,MG7200719,Meeting Materials,Pass agent future argue sort amount during pay hair rather.
300,D,MG5852259,Memory Materials,Should process commercial seem grow red.
200,D,MG4630014,Law Materials,At bill here method.
100,D,MG7112605,Miss Materials,Dark social create dog strategy government her.
300,D,MG4471887,View Materials,Easy food strategy cover performance since.
300,E,MG4103717,Return Materials,Build few cut everything per happen threat.
400,E,MG9106128,Paper Materials,Seat institution prevent us.
200,E,MG4656087,Many Materials,Clear great health respond such military forward her televis
300,E,MG9035082,Until Materials,Behind until need drop authority voice check similar center 
100,E,MG5085371,Seem Materials,Pm minute reveal in on cold me.
100,D,MG3176855,Off Materials,Number music politics model wait you.
400,D,MG7025273,Operation Materials,Result few wall leave own.
100,D,MG4097193,Case Materials,There ok newspaper begin option right measure whom sort.
100,D,MG4154660,Need Materials,Student evidence traditional education check.
200,D,MG7028906,Recognize Materials,Picture increase outside meet partner kitchen.
300,D,MG5161770,Development Material,Peace continue treat happen give no science product bill pea
300,D,MG4125160,People Materials,Eight great space although same citizen society audience ans
300,D,MG7716932,Actually Materials,More law happen create class.
300,D,MG3506232,Expect Materials,Reality film start focus action door dinner half.
100,E,MG6185351,Actually Materials,Republican consumer business send commercial card actually.
300,D,MG4256695,Speech Materials,Campaign sea part investment low.
200,E,MG7557988,Explain Materials,Southern parent choose enter effort think.
400,E,MG5267941,Because Materials,Pass back clear increase natural.
100,D,MG2844988,Begin Materials,Shake without thank receive eat minute tree watch.
300,D,MG4195006,Military Materials,Family mother fall base quite finish trade.
300,E,MG5692057,Dinner Materials,Kind win property quickly town provide bag degree.
300,D,MG4795340,Church Materials,Knowledge rest company first eight because experience.
200,E,MG8538361,First Materials,Start many necessary court get they.
400,E,MG1293244,Pressure Materials,Since practice describe quality ever business operation.
200,E,MG5345943,Cause Materials,Hospital month even feeling candidate ago marriage relate ha
300,E,MG6880070,Yard Materials,Financial smile ability political avoid surface especially s
100,D,MG2534337,Country Materials,So word course assume month.
400,E,MG9341733,With Materials,Road such describe fine available condition discover game.
200,E,MG7065223,This Materials,Reality traditional chance treat tax performance reason wear
100,E,MG1725889,During Materials,Despite despite card thank call describe.
300,D,MG1062671,Would Materials,Left all wide population forget.
200,D,MG3672364,Trip Materials,If often dinner agreement.
400,D,MG2176517,We Materials,Join cause fear fund base.
200,E,MG9557619,Film Materials,Reveal choice once plant human such today risk.
400,D,MG9470892,Whom Materials,Quite amount could push likely state peace size.
100,E,MG7804581,Always Materials,Own stay power direction past five suddenly go benefit.
400,D,MG8232384,Member Materials,Significant work building training establish position learn.
400,E,MG3608323,Wonder Materials,Lot kid fly animal loss determine appear race decade.
400,E,MG2300790,Nature Materials,Last money member forget then serve strategy wife.
400,E,MG1702259,Face Materials,Analysis practice same local perhaps loss.
400,E,MG5891961,Usually Materials,Few house hundred toward staff community evening design prov
300,D,MG2640290,Toward Materials,Recognize president human management opportunity say exist p
200,E,MG1283398,Allow Materials,Lose forward fall key class win.
400,E,MG1975558,Two Materials,Door religious suddenly feeling pick ago hear.
200,D,MG3272046,Training Materials,Major meeting standard perform style.
400,D,MG2940934,Card Materials,Through skill simply action system list result stock.
100,D,MG1108764,Edge Materials,Figure movement able detail interest less gun size far help.
300,D,MG7990542,Accept Materials,Plan discussion agency reduce push all second six authority.
200,D,MG6918644,Box Materials,Toward so business theory expert staff discussion.
400,D,MG7479230,Want Materials,Bring them book whether side later million seem allow health
300,D,MG2932343,Skin Materials,Bank seat stay condition yourself long still.
400,D,MG1619966,Shake Materials,Activity often opportunity gas doctor economic south baby se
400,D,MG5919366,Painting Materials,Threat onto shake far put put school challenge.
200,E,MG5147744,Production Materials,Write above difficult language call decision believe medical
100,E,MG9068320,Challenge Materials,Job produce fear discussion today have exactly.
200,D,MG3562634,Remain Materials,Reach identify follow effect style.
200,D,MG8731642,Bag Materials,Between treatment cup than have word early.
200,D,MG7573706,Condition Materials,Pretty think sell skill next action painting anyone owner.
300,D,MG1791516,Individual Materials,During third safe surface song talk couple.
300,D,MG2865151,Often Materials,Knowledge law sense after yourself buy who skin without risk
200,D,MG6106008,Necessary Materials,Citizen mean wrong price ten save.
200,D,MG7108031,Character Materials,The to myself cost prove run collection.
100,D,MG3361167,Because Materials,Line left everything six company hand address music mission 
400,E,MG7959127,Generation Materials,Low day blood level least else.
200,D,MG6150866,Ground Materials,Laugh huge more action most policy front style particular.
100,E,MG8527035,Drop Materials,Yard traditional dog close appear.
300,E,MG4181954,Energy Materials,Soldier write same why approach investment social morning fe
300,E,MG5807475,Stand Materials,Room song report main determine contain teacher.
300,E,MG5246402,Or Materials,Financial but teacher table.
100,E,MG3188981,Parent Materials,Why piece trip eye focus story.
400,D,MG6236175,Share Materials,Two radio decade particularly.
200,E,MG4612509,Operation Materials,Represent guess former subject space.
300,E,MG4473505,Character Materials,Whom agreement debate stage or.
300,E,MG4349703,Security Materials,Research community lose resource capital.
200,E,MG4525520,Management Materials,Allow blue gas produce result.
200,D,MG2149236,Apply Materials,Surface event nature water detail police phone represent cer
100,D,MG4386914,Represent Materials,See those sense network pattern particularly talk human wait
200,D,MG8586693,Article Materials,Represent free fish over another why general huge per.
400,D,MG1319474,Trade Materials,Tax performance control teach push too fire scene.
200,D,MG8615734,Environmental Materi,Make center such wrong shake town best throw.
200,D,MG6394606,Skill Materials,Audience whose deal know politics.
400,D,MG1920930,Blood Materials,Employee back new quickly author century police Congress.
400,E,MG9280890,Skin Materials,Worker five stand player work use hard present perhaps inves
200,D,MG2593026,Team Materials,Meet research risk food avoid fall grow expect particular se
200,E,MG8049324,Require Materials,Seven alone ability enough north all condition.
400,D,MG3912412,Next Materials,Score energy dinner stock sea painting boy idea.
400,D,MG6837976,Difficult Materials,According eye alone people buy research along choose wind th
300,E,MG9256535,Partner Materials,Attack what Democrat poor treatment memory computer city.
300,D,MG8242070,Feel Materials,Those still science organization blue local buy education th
400,E,MG5450319,Go Materials,Another strategy dream traditional far.
100,E,MG2397367,Usually Materials,Usually be relationship rest move single let.
100,D,MG1942100,Marriage Materials,Nation personal color gas force anything wear.
300,D,MG5461244,Price Materials,Partner keep alone across try indicate score officer floor.
300,D,MG4532352,Actually Materials,Decision so once stay six suddenly lawyer environment easy s
100,D,MG5162631,And Materials,Beat body radio candidate child your.
300,E,MG3752591,Help Materials,Land message would military song share soon since side.
300,D,MG5902631,Thank Materials,Whom explain Republican power resource sit you.
400,D,MG9711370,From Materials,Radio still stage cause beautiful.
100,D,MG7902589,Wait Materials,Reach interest send his my able usually compare avoid.
400,D,MG8129789,Leave Materials,Memory yet language able plan water early coach eye.
400,D,MG7429683,Once Materials,Want medical particular try begin.
100,D,MG8982497,Movie Materials,Republican bag give simple choose contain avoid movie almost
300,D,MG3649106,Light Materials,Foreign feeling near agree partner charge recently turn acti
100,E,MG6277233,Day Materials,Try clearly question behavior financial culture quality we b
300,D,MG1059571,Seek Materials,Let might recent thought draw in lay a event.
200,D,MG3462245,Skin Materials,News long those score political.
200,E,MG3444111,Personal Materials,As catch nothing set hear raise south action wear.
200,E,MG1814683,Occur Materials,Plan commercial course opportunity financial somebody.
200,E,MG4208290,Event Materials,Knowledge because class name explain pay factor such.
100,D,MG4984488,But Materials,Plant light sure night how opportunity major can.
300,D,MG4209725,Respond Materials,Night road quite arm face feel thank us body hope.
400,D,MG4543796,Quickly Materials,Campaign determine over develop political program.
400,D,MG3841037,Father Materials,Son lose end push everyone upon prepare surface.
400,D,MG7331864,Statement Materials,Little test allow paper answer listen feel.
400,E,MG6197687,Authority Materials,Though message appear care environmental up enter example of
100,D,MG1827242,Quality Materials,Process modern somebody world foreign.
200,D,MG4471229,Along Materials,Fish win training type thank deal feel ability day late.
400,E,MG6530614,Tend Materials,Live deal stay remain Democrat various.
200,E,MG9246743,Another Materials,Remain wife blue feel it identify though truth high federal.
400,E,MG5237000,Son Materials,Hope area rise officer focus visit allow high book station.
200,D,MG7457953,Skin Materials,Past size occur behavior make once whose.
300,E,MG5789776,Technology Materials,Way fear yes buy firm oil resource hit within.
300,E,MG8568636,Bank Materials,Here up traditional stuff play west.
300,E,MG3096895,Music Materials,Matter until born though.
200,E,MG4735497,Wonder Materials,Life ten recently field.
400,E,MG6991017,Result Materials,Character card important interesting exactly.
300,E,MG2836545,Lose Materials,Heavy voice glass animal spend newspaper loss there history 
100,E,MG7119725,Though Materials,Dinner education speak wind remember now time take prove pat
300,E,MG8875853,Mission Materials,Particularly thousand your participant standard set.
300,E,MG5042972,Ten Materials,Understand notice set morning.
400,D,MG1278829,People Materials,Point administration design performance choice.
400,E,MG8475686,Guess Materials,However alone Mrs firm there computer involve.
300,E,MG1338495,Debate Materials,Teach bar represent institution career adult.
200,D,MG7881489,Listen Materials,Trade news staff again tax building fall between join phone.
100,E,MG6825634,Think Materials,Alone section number side when fast.
200,D,MG6583158,Former Materials,Around threat history education wind gun Congress accept.
200,D,MG1345055,Field Materials,Cover military during four any moment.
100,E,MG6365996,Unit Materials,No police wide seat everyone.
200,D,MG1192112,Daughter Materials,Someone effect economic image.
100,E,MG8203084,People Materials,News wind yes fire others chance.
400,E,MG3124450,Foreign Materials,Weight crime rock own green expert.
300,D,MG2748439,Agreement Materials,Away investment face art feel.
100,E,MG1166534,Democrat Materials,Audience appear at happy moment wear analysis task cultural 
300,E,MG4633688,Remember Materials,Education assume interest teach collection rather on rest tr
300,E,MG4607827,Opportunity Material,Whose Congress above watch red ability sport gun yes.
400,D,MG2951164,Everyone Materials,Old see catch marriage road lay have.
100,D,MG5879223,Surface Materials,Take democratic live soon perform amount billion.
400,D,MG3743564,Guess Materials,Population spring item walk usually season.
300,D,MG9050649,No Materials,Because ready director left toward form respond second.
200,E,MG1801319,May Materials,Lead bed imagine decide class western fill I.
100,E,MG2065766,Million Materials,Behavior professional leader understand between remain once 
100,E,MG9771070,Front Materials,Item play class card help game make almost.
300,D,MG7615679,Test Materials,Teach bag some ok risk particular.
200,D,MG4917736,Similar Materials,Must audience collection speech important crime must than pr
100,E,MG3944882,Amount Materials,Nearly worker professor marriage.
100,D,MG1049641,Offer Materials,Order treat tree real table.
400,D,MG3013163,Idea Materials,Hard east station attention power our most city this.
100,E,MG2977622,Of Materials,Various power official happy attention way manager.
200,D,MG6878289,Area Materials,Most coach think way management.
300,E,MG1850439,Mention Materials,Morning break at figure produce million suffer arrive.
300,E,MG2708871,Doctor Materials,Ahead child goal conference chance make seem lot decision.
200,E,MG2854164,Development Material,Sound ability model seven me tough likely there rich.
400,D,MG3507292,Lawyer Materials,Though company site bit.
200,E,MG8185141,Brother Materials,Today discover now I cause gas ability information cold.
200,D,MG9980583,Almost Materials,Able four be sing operation.
200,D,MG9834683,Nearly Materials,At finish moment family decision along your western.
100,D,MG4039791,Address Materials,Top brother bank prove.
100,D,MG9180980,Cover Materials,Make phone word economic teach son grow risk treatment paper
400,E,MG4238780,Scientist Materials,Economy old nor worry bad.
100,E,MG8660541,One Materials,Even final attorney scene rest again.
100,D,MG6758884,Either Materials,End author leader live must better.
200,D,MG1347362,Job Materials,Garden candidate discuss forget bit.
300,D,MG7177540,Such Materials,Military write middle go ok education their.
200,D,MG9716554,Air Materials,Finish course like hear scientist stage low.
400,E,MG6921687,Indeed Materials,Other administration involve note prepare former finish.
400,D,MG3330633,Hope Materials,Just financial quickly central cold certainly fast.
400,D,MG5671303,Where Materials,Water tend of none dinner apply truth.
300,D,MG7737653,Rather Materials,Guy court mean morning support effect report though decide n
400,D,MG7670747,Threat Materials,Language leg all affect admit later weight spring perform ev
100,D,MG1998244,Civil Materials,Lead standard today boy region involve resource.
200,D,MG9528284,Clear Materials,Increase travel adult once big book.
300,E,MG6504001,Word Materials,Southern my operation open near.
200,E,MG6694508,They Materials,Between trade film stand record strong stop.
400,E,MG7885996,Special Materials,Suggest former often second from lead similar impact.
100,D,MG6886326,That Materials,Establish approach economic assume role north run agency.
400,E,MG3507049,Alone Materials,Party clear practice big raise something.
300,D,MG7682867,Including Materials,Collection charge tree father authority guess after office w
100,E,MG7733696,People Materials,Find cell throughout center author foot job difference recor
300,D,MG5198976,Story Materials,Whole Mr must cold brother bank lot least.
300,D,MG6995243,Performance Material,Report inside role who school resource place realize.
100,E,MG4885908,Certainly Materials,Feel accept admit risk indeed often wrong miss organization 
100,E,MG4240221,Happen Materials,Successful sport new whom husband indicate speech agree war.
100,E,MG6676648,Class Materials,Big reflect window much security each size think build.
400,D,MG8254618,City Materials,In choose find key him fight agreement film.
100,D,MG4632078,Career Materials,Including different business argue everybody will.
300,E,MG1388264,Unit Materials,Significant drop identify population everybody whom agent sp
400,D,MG1130693,Party Materials,Wonder around trip glass knowledge western do prevent.
300,E,MG5885550,Red Materials,Baby million article sometimes sign interesting police.
100,D,MG6381580,Value Materials,Report smile base capital try notice him page whom size with
400,D,MG8564803,Rise Materials,Save produce level blood way method.
100,E,MG6755603,Space Materials,For where describe finally experience themselves wish Americ
200,E,MG3182319,Pretty Materials,Decide commercial scene see similar treat conference brother
300,E,MG8858347,Today Materials,Century responsibility drive girl staff reveal room politica
100,D,MG6092694,Have Materials,Reduce simply give threat thus service use by some.
200,E,MG6145716,Near Materials,Soldier still pull sort a start.
300,D,MG6661003,Against Materials,Low hotel yourself boy play hit might.
400,E,MG2116860,Degree Materials,Late prevent hot role treatment body everyone few environmen
100,E,MG9872328,Arm Materials,Interview talk choose way decision difficult practice note o
100,D,MG9449121,Prove Materials,Low series something view some process sound.
300,D,MG8818019,Wall Materials,Adult shake style leg least least improve anything tax.
300,D,MG9638251,Remember Materials,Machine machine scientist past get.
400,E,MG7453676,Indicate Materials,Enter almost feeling true.
100,D,MG8524168,Coach Materials,Enjoy reveal fear campaign whether.
100,D,MG2013477,Produce Materials,Study natural kid dark but series.
400,D,MG6205594,Minute Materials,Often why care boy identify.
100,D,MG4877875,Many Materials,Movie game soldier who idea its though nice.
200,E,MG8375104,Major Materials,Tonight memory response accept start.
200,D,MG4123357,See Materials,Say anything its all future young while culture baby.
300,E,MG2900532,Join Materials,Military car writer instead begin million lawyer interview.
300,D,MG6222710,Edge Materials,Box drive experience wife suddenly side remain mean.
200,D,MG9750927,Their Materials,Week reveal treatment mother sure energy save.
100,E,MG1490556,Recent Materials,Check increase fish represent you when or must know.
200,D,MG1757905,Gun Materials,Way act her up view add adult seven play modern summer.
400,E,MG8657770,Full Materials,Whom table people around prove threat show begin money.
400,D,MG5588659,Mean Materials,Represent plan sit break drug home million.
200,E,MG6363089,Dark Materials,Term media audience now east technology remember religious.
300,E,MG2172100,Notice Materials,Anything learn anything sport school executive.
100,E,MG9955900,Power Materials,View doctor sing lot health full two since.
400,D,MG5659998,Foot Materials,Employee act price teach standard.
400,E,MG6408222,Budget Materials,Born contain general data people stop what care read interes
300,D,MG3066505,Think Materials,Important air lose glass then door sure address.
100,E,MG4381862,Brother Materials,Director hard particularly trial thousand woman significant 
300,D,MG6465127,Through Materials,Tree skin ever direction address response.
100,E,MG5803884,Drug Materials,Partner economic ever team now discover economic letter.
400,D,MG6865288,Maintain Materials,Establish science far technology scientist view parent.
