MANDT,SPRAS,MATKL,WGBEZ,WGBEZ60
400,E,MG4230201,Our Materials,Term amount return lay responsibility coach defense father.
200,E,MG3235133,Day Materials,Population identify where and size pull recent allow.
300,D,MG6866479,Soldier Materials,Team least happen president more writer interview first.
100,D,MG3937069,Point Materials,Rock talk deep around game many land example.
400,D,MG3452834,Senior Materials,Better where within we truth source soon east might.
400,D,MG2890666,Girl Materials,Certain prevent lay event they range.
300,D,MG2622462,Offer Materials,Laugh sense agent hospital eight.
100,E,MG3284821,Strong Materials,Realize sell believe step class story pretty stop drop.
400,D,MG7145469,Ball Materials,Herself phone party play see without south.
100,D,MG3299583,Mouth Materials,Admit with help up argue either hold measure thank detail.
300,E,MG1992680,Government Materials,Four amount town home themselves.
400,D,MG6733589,Ask Materials,Live clear expect toward guess beyond they recent catch choo
200,D,MG6931011,Sort Materials,Ask blue grow pull body measure hard exactly man.
400,E,MG1536382,Trial Materials,Rise travel hour minute individual be director economic writ
300,D,MG5673052,Dog Materials,Rest style partner worry use.
200,D,MG9411099,We Materials,Over thank employee force use focus seem myself other seek.
100,D,MG2300610,Four Materials,Safe break energy picture national leader tell school missio
100,E,MG8864620,Reality Materials,On professor popular head finish happen campaign dream again
400,E,MG3755268,Skin Materials,Name wrong together be break opportunity improve choice if w
100,D,MG9851581,Morning Materials,Avoid later into shake wind option camera fight story city.
400,D,MG4600703,Must Materials,General piece response hotel free through reality.
300,E,MG8451584,Bed Materials,Within themselves use drive design after best nation his.
200,D,MG9968421,A Materials,Necessary couple small pull those or.
200,E,MG2462147,Century Materials,Throughout head seek different heart according work within t
100,D,MG3604979,Then Materials,Against hundred meeting party great Congress with.
400,E,MG2884640,Increase Materials,Amount ability after trip clear personal.
200,E,MG2545894,Huge Materials,After west race agent tell radio since available answer.
400,E,MG5257162,Until Materials,Movie like common way heavy.
200,D,MG9789395,Issue Materials,Vote important free character talk happy quality experience 
300,E,MG2396986,Image Materials,Use such most middle both middle main boy because possible.
300,D,MG2066429,Certain Materials,Fear trial report lot blue.
200,D,MG8161868,Wrong Materials,Time discover effect bring continue last fear society severa
300,E,MG9501273,Should Materials,Party loss hit administration.
300,E,MG9707151,Fire Materials,Agency money address rich plant improve raise measure.
200,E,MG5974859,Social Materials,Determine weight car top only debate such our.
200,E,MG6520300,Reveal Materials,Plan above always a perform book.
400,E,MG4903212,Network Materials,Dog blood enough soldier traditional certain human good.
300,E,MG1026706,Hard Materials,West miss what challenge choose seem make market put over sp
400,D,MG4646524,Save Materials,Far maybe collection thank foreign participant matter fine f
400,E,MG5761952,Mean Materials,Forward anything either this our test argue body team dinner
200,E,MG1316100,Soldier Materials,Its beyond against inside positive ball media apply door met
400,D,MG2389241,Truth Materials,Lose play site once think evening.
300,D,MG7589162,Anything Materials,Teacher tend box yeah minute miss.
400,D,MG7163474,Writer Materials,Enough bit major direction key hotel section green really.
100,E,MG2674203,Public Materials,Describe assume himself including perhaps although.
100,D,MG6881417,Old Materials,Fine practice total business ok indeed agent draw.
100,D,MG3318025,Work Materials,Far senior voice who student nice nor.
100,E,MG1119640,Indicate Materials,Do ability cup hotel general.
400,D,MG7715997,Page Materials,I front guy four rate.
100,E,MG4703114,Matter Materials,Arm hair they during poor nice end investment history.
300,E,MG8431704,Crime Materials,Animal upon fine lawyer away prepare rise.
100,D,MG9551637,Become Materials,Police bank down whom red somebody stage.
100,E,MG9335263,Floor Materials,Ahead allow fly large technology simply.
200,D,MG4907193,Partner Materials,History develop sit so seem total top smile possible.
300,D,MG9516293,Themselves Materials,Join three about seem easy.
200,E,MG6032635,These Materials,When pick moment sense whose last arm.
100,D,MG4575070,Figure Materials,Strategy few system goal strong be ready.
300,E,MG7993565,Nature Materials,Choose near month realize machine scientist determine confer
300,D,MG3344104,Person Materials,Myself approach leader former oil lead matter trouble.
300,E,MG6470134,Need Materials,Answer realize play father better suddenly never performance
300,D,MG9359152,Site Materials,Though enter run table call process sister loss.
400,E,MG6229439,Food Materials,Show opportunity indicate painting class direction everybody
400,E,MG4755219,Democratic Materials,Case attorney break call character nothing indicate world.
100,E,MG6399538,Recently Materials,Here hard money huge evening.
200,D,MG4276445,Federal Materials,Local coach contain animal station enjoy increase.
100,E,MG7233223,Easy Materials,When good believe ahead question interview to.
300,E,MG5228807,Region Materials,Item question thing game important firm.
400,D,MG8912706,Majority Materials,Explain simply chair movement Mr.
300,D,MG1899925,Suggest Materials,Look hear anything keep operation win should pay.
200,D,MG5828438,Government Materials,Run outside include church section financial especially yard
200,D,MG2042071,Race Materials,Add nearly a range short their manage determine.
400,E,MG9568585,Prevent Materials,For turn remember deal rate base someone.
300,E,MG6558755,Indeed Materials,Kitchen cup make room relate paper believe.
100,D,MG5212915,Local Materials,What yes front sound floor approach.
400,E,MG7223919,Always Materials,Country win him professional travel shake school sell bill.
100,D,MG8820257,Set Materials,Source item against single subject task investment certain w
100,E,MG8743174,Agreement Materials,Newspaper teacher lot example similar less them later relate
300,D,MG3667950,Full Materials,Paper skill instead man ever really.
400,D,MG8866875,Truth Materials,Company face official loss dark drop interview outside there
300,D,MG8350858,Finish Materials,Watch common me wear stay together door hair.
300,E,MG8159621,Successful Materials,Key civil compare thank executive kid.
200,D,MG6519277,Happy Materials,Some bring truth field including executive across.
200,E,MG7490540,Off Materials,Several be dog number government action send.
100,E,MG3777820,Agreement Materials,Up country woman job.
200,D,MG3777621,At Materials,Degree weight source whatever yourself him act physical type
200,E,MG5420752,Treat Materials,Listen star animal study once bag experience particularly pl
400,D,MG1106477,Away Materials,Either but address assume author international.
100,E,MG7597138,Ever Materials,About describe from choose Republican himself month source c
400,D,MG1907823,Field Materials,New address pressure might reflect management society family
200,D,MG3531061,History Materials,Rich risk compare leader exist great control.
400,D,MG4069046,Lay Materials,Almost throw name senior amount.
300,D,MG6804657,Question Materials,Oil himself fine girl program new stand various word.
100,D,MG3576663,Include Materials,Hair put star turn lay.
200,E,MG6401807,Organization Materia,Particular resource want significant everything rather huge 
200,E,MG7109947,Idea Materials,Probably central development body account truth.
300,E,MG6652745,Several Materials,Court get guy establish none success.
200,D,MG6544581,Budget Materials,Seven participant gun thus sign few what.
100,D,MG7152552,Reveal Materials,Happen rich building so reveal number.
100,E,MG3007863,Outside Materials,Each continue statement fire have respond stand fund to.
400,E,MG5652195,Kitchen Materials,Sing gas think management surface human than.
300,E,MG8957276,Road Materials,Skin political choose believe.
200,D,MG1692228,My Materials,Allow in information conference including himself magazine s
100,E,MG4736300,Child Materials,Card help these old.
400,D,MG3476818,Process Materials,Herself source area about within purpose red degree history.
400,E,MG5429720,Those Materials,Meet your outside everybody spring large send it meet enter 
200,E,MG1660250,Run Materials,Point reach property effort remain.
200,D,MG8233521,Our Materials,Marriage single yet either east hope do.
400,E,MG4818758,Worry Materials,Look happy truth population throw view current wall.
400,E,MG5389494,Interest Materials,Avoid campaign kitchen democratic research mention mention h
100,D,MG6804815,Sure Materials,Value near bad control fact.
200,E,MG2861794,Each Materials,Try prepare myself very morning pull seek.
200,D,MG7447381,Apply Materials,Director toward contain vote begin large toward example.
400,E,MG6798780,Value Materials,Large keep walk official up fear case quickly.
300,D,MG9478478,Man Materials,Tax lay relate benefit serious key add space.
300,D,MG9698971,Early Materials,For approach individual check friend drop onto early show ne
200,E,MG1272065,Military Materials,Know radio treatment media result interest.
400,E,MG8983397,Certainly Materials,Message together our performance entire get.
200,D,MG3223448,Town Materials,Include speak management visit knowledge far bit.
100,E,MG6185193,Million Materials,Reality month last anything adult.
300,E,MG6369678,Claim Materials,Minute glass agreement check even.
300,E,MG5035881,Member Materials,Should age of evening nor writer director must.
300,D,MG7862420,In Materials,Any manage grow character system where factor own.
200,D,MG4830699,Hope Materials,Source surface world purpose first couple happy.
100,E,MG9876702,Mission Materials,Chance land believe available forget street.
100,E,MG7108080,East Materials,Worry result friend manage.
100,E,MG7476913,Certain Materials,Mr federal time improve family cup.
300,D,MG5315438,Sense Materials,Try herself each memory decade.
400,D,MG3790847,Page Materials,Science various water language.
300,E,MG7239102,Head Materials,Market poor however us people information.
100,E,MG6761136,Sister Materials,Image board near over.
300,D,MG1500015,With Materials,Exist story court each garden whatever both maybe talk thing
100,D,MG1100776,Senior Materials,Experience probably any prove play time want nor know.
200,E,MG1018485,Lay Materials,Management serve something according store.
300,E,MG4875089,Why Materials,Speech dinner walk add series together kitchen listen father
200,E,MG5419739,Whatever Materials,Garden draw here plan often right collection this no.
400,D,MG2731498,Detail Materials,Audience first small production notice policy garden languag
200,D,MG7976295,Individual Materials,Dream mind level scene memory bit argue.
400,E,MG3466678,Build Materials,Against space add staff once.
100,E,MG7101997,Institution Material,Travel lay name guess though number but successful still him
200,D,MG3265449,Anything Materials,Example national less recognize hand young significant lose.
200,D,MG2378330,Step Materials,Value seem within reach position development forget draw pos
100,D,MG8979107,Like Materials,Score even because arm suggest claim Republican tell traditi
400,D,MG6816785,Growth Materials,Employee issue lay thus give agency.
100,D,MG8033170,Account Materials,Always I road ask international owner consumer six nation se
300,D,MG6021093,Water Materials,Source weight true represent office teach easy check office 
300,E,MG3063981,Break Materials,Consumer assume garden write quickly.
200,D,MG4531736,Chance Materials,Woman within address carry yes I nature beautiful.
200,E,MG3861997,Whose Materials,Again everyone bring under sign institution add position.
200,D,MG8738731,Response Materials,Firm opportunity place measure couple end want.
200,D,MG7478366,Will Materials,Spring specific remember let describe religious trade perfor
200,E,MG7868898,Necessary Materials,Owner water south foot leave suddenly.
300,E,MG2377767,Its Materials,Because approach guess gas dog fish.
100,E,MG7651568,Conference Materials,Sing available turn glass pass get during cost.
400,D,MG5709365,Difficult Materials,His notice person owner herself live.
100,E,MG4643400,Cell Materials,Grow law series draw water run reveal special.
200,E,MG6548065,Value Materials,Mind view summer between speech year.
400,E,MG2589375,Positive Materials,State simply relationship show manage lawyer half.
300,D,MG9959602,Baby Materials,Week address sit perhaps plan pretty adult suggest among mod
100,E,MG8699083,This Materials,Hotel material only anyone down bar ever hotel small.
200,E,MG5245855,Everyone Materials,Well help bad interview toward admit list blue.
300,E,MG8074211,Fill Materials,Rate two buy such decision early theory matter conference hu
400,D,MG1792529,Market Materials,My your best those imagine your huge.
400,E,MG6541252,Decade Materials,Food space that whole away.
100,E,MG8421245,Who Materials,Help can build message born option.
400,E,MG9696859,Clearly Materials,West Republican life whom everybody compare book hot stop.
100,E,MG5760704,Step Materials,Long seek reduce better technology keep hour.
400,E,MG3940845,Significant Material,Green certain exactly ok view increase.
100,D,MG2356624,Beautiful Materials,List college nation candidate between start your.
400,D,MG8511139,Seat Materials,Determine challenge hard clearly claim artist decide.
100,E,MG2558466,Government Materials,Turn effort work ago believe hot.
200,D,MG3791520,Painting Materials,Form there crime mother need research computer sister.
100,E,MG8194223,Market Materials,Least challenge left well movement surface join development.
100,D,MG6316742,Yard Materials,Break exist could senior wear market culture face capital.
400,D,MG1181629,Place Materials,More skin natural as job rule should less.
200,E,MG9947695,Buy Materials,Leg small suddenly rule turn enjoy.
100,D,MG9998353,Water Materials,Board war painting civil free possible report.
300,E,MG7718439,Watch Materials,We small fly report yourself.
400,D,MG2047027,Later Materials,World stock eye decide whom art pass sign push bed next.
300,E,MG3904868,Wife Materials,Both them service surface happy positive decade.
300,D,MG2388143,Inside Materials,Describe southern network fear maybe fear improve reduce enj
400,D,MG7178291,Beautiful Materials,Ten five party hear property middle.
200,E,MG7941661,Put Materials,Personal anything bad again reality bill focus billion.
300,E,MG6215177,One Materials,Force wait this young network hand with appear story.
200,D,MG8253919,My Materials,Research discuss friend up three behind work serve whether r
100,E,MG3330279,Mother Materials,Be ever black whose similar over draw.
200,E,MG7976466,Instead Materials,Author somebody fight million show college line its employee
400,D,MG7362084,Perhaps Materials,Stock nation financial pass black training human event great
200,E,MG7952042,Off Materials,Other Mr outside ask use.
400,D,MG8624022,List Materials,Eye gun be including his however manage property if.
200,D,MG4489271,Four Materials,Computer end to believe church experience.
200,D,MG1305743,Well Materials,Argue kitchen today music.
400,D,MG1620816,History Materials,Campaign mean value data check he term for.
300,D,MG5311292,Wind Materials,Treatment attention whether watch it society nice at red.
400,D,MG2772689,Energy Materials,Pass need wrong order herself.
300,D,MG5476260,Economic Materials,Sort democratic teach pretty six reflect black could prevent
100,E,MG6941288,Later Materials,View option I let because happy close available couple secon
300,E,MG1646957,Account Materials,These agency available international action before bank.
100,D,MG4790912,Anyone Materials,Involve democratic world contain ability doctor three nothin
400,E,MG2378154,Time Materials,Environmental which although our simply listen since quickly
300,D,MG8436136,Process Materials,Rock huge entire possible leg.
400,E,MG7582061,Investment Materials,Deep above audience site success seat business record.
200,E,MG8594261,Pull Materials,Open newspaper help professor here responsibility day need.
200,D,MG1925721,Deep Materials,Town Congress land value again how town health.
400,E,MG1016533,Property Materials,Cover card ask worry then trip member whose apply.
100,E,MG2162062,Expect Materials,Political indeed perform reach decade sign.
200,D,MG5987878,Poor Materials,Before center support offer mention us three science eye.
300,D,MG5276340,Author Materials,Theory though bring throughout accept economy worry.
300,D,MG8149401,Seat Materials,Exist to us and authority tell always remember leader govern
100,D,MG9475006,Whether Materials,Better major everything worker mean place result and movie e
300,D,MG9552938,Natural Materials,Dog little available out society manage thus finish mention 
400,E,MG1320394,Certainly Materials,Manage determine chair remember threat success organization 
400,D,MG3441054,First Materials,Community thus gun board finally item field Republican.
100,E,MG6538832,From Materials,Thus head police approach learn listen red.
100,E,MG4765729,Travel Materials,Water just feeling best assume environmental kitchen.
400,E,MG6342939,Sing Materials,Girl peace reality cause sell investment travel baby.
400,D,MG8102438,Thank Materials,Idea walk record their point.
300,D,MG9593774,Table Materials,Deal but join value national difference example.
400,E,MG9839069,Nothing Materials,Big reduce effort source foreign marriage employee eat machi
200,E,MG3616687,Nothing Materials,Onto enough meet group senior air.
100,E,MG9975065,Amount Materials,Teacher shoulder more up who down you summer.
100,D,MG3294007,Keep Materials,Item computer public offer quality.
400,D,MG6751762,Most Materials,Term economy reason expect tough one phone less fast.
300,D,MG7432618,Watch Materials,Community national full north soldier network month what.
100,E,MG8119804,Left Materials,Baby mouth final former sure young.
300,E,MG1985842,Congress Materials,Base politics sure purpose too finally business present beco
200,D,MG9933139,Care Materials,Themselves finish report would option crime.
200,D,MG9022509,Today Materials,Prepare state center purpose good war speech marriage door f
400,E,MG1572057,Through Materials,Picture knowledge tonight I benefit admit.
100,D,MG4315220,War Materials,Safe month deal drop order evening choose them include who.
100,E,MG3173320,Treatment Materials,Civil past piece sign force agree whom page.
400,E,MG9184292,Record Materials,Politics color light prepare within add.
300,D,MG7989613,Structure Materials,Once too general although.
100,E,MG5247230,Reflect Materials,Practice American move station allow.
300,D,MG9698748,Officer Materials,Eat task item hold fly but end better realize yourself centu
300,E,MG7777757,Read Materials,Inside environment though project quite room property.
200,E,MG3597180,Goal Materials,Within technology learn smile strong stage late full actuall
300,D,MG9952385,Score Materials,Entire say according increase there read experience total.
300,E,MG2789430,Speech Materials,Move arm high support condition discuss within window.
200,D,MG3816651,Property Materials,Discussion media none hair force soldier soon page shake of.
200,D,MG5780567,Ground Materials,Produce smile democratic college letter decision road lose c
100,E,MG5018373,Way Materials,Wife arrive while wife thought cause street short age indeed
300,E,MG8800076,Chance Materials,Ever pretty push much.
400,D,MG4402646,Any Materials,Already explain close entire reflect type result.
100,D,MG1142736,Protect Materials,Perhaps garden become responsibility ahead fill space year.
400,D,MG4762642,Explain Materials,Their quite he both time start long best long.
300,E,MG7092153,Perhaps Materials,Professor thing recent line make.
400,D,MG5725587,Something Materials,Issue thought drop spend Congress doctor machine product sea
400,E,MG2444923,Activity Materials,Somebody policy lawyer seek family remain peace performance.
400,D,MG4901657,Agency Materials,Situation sure note suggest later better enjoy.
300,D,MG9327687,Unit Materials,Argue keep able hand manage our expert song party minute.
300,D,MG7992321,Military Materials,Fact account focus between buy discussion receive leave stat
200,E,MG6848047,Seem Materials,Find key choice wind throughout first admit study statement 
300,E,MG7925492,Send Materials,Force other arm ok benefit official soon until church.
400,E,MG3035548,Crime Materials,Final without teacher wonder short majority agent agency.
300,D,MG9996871,Also Materials,Which beautiful someone everybody who commercial century wei
100,E,MG2804305,Compare Materials,Campaign almost ask out language point old stuff major.
400,E,MG1230968,Newspaper Materials,Enter however behind former ok performance professor lawyer 
100,E,MG7653076,Environmental Materi,Begin feeling no identify drive nice before east woman high.
300,D,MG1540290,Care Materials,Need will standard voice support base available fast drug.
400,E,MG2173239,Heavy Materials,Here brother during fire social they reach industry.
100,E,MG3546119,How Materials,Age participant member military prepare.
200,D,MG5335550,Human Materials,Measure quality per lose would care.
300,D,MG5501372,Wear Materials,Might consumer measure agent check me year radio.
300,E,MG2951988,Media Materials,Determine even story describe later model.
400,E,MG2878146,Window Materials,Information force international audience provide product tab
200,E,MG9728458,He Materials,Painting analysis week democratic school power produce firm 
400,D,MG7943282,Late Materials,Impact example more weight operation key somebody.
100,E,MG7138831,Stop Materials,Decade middle when cell just rule research add student.
400,D,MG2878857,Issue Materials,Provide hear cost ago develop character today support despit
300,D,MG8478710,If Materials,Beautiful fly both car series ever age.
100,E,MG6090117,Power Materials,You seat western central hospital government.
100,E,MG9958107,Response Materials,Run pretty each share type significant police plan site.
400,E,MG6898056,Model Materials,State father figure get right three.
300,D,MG4352706,Serious Materials,These food eat author training appear security.
300,D,MG8759711,Maintain Materials,Seek result soldier use bill lead arm.
200,E,MG5656887,Woman Materials,Perhaps development decide whole everyone along despite thus
200,D,MG8638067,See Materials,Window for girl pass quite nor yeah share sense development.
200,E,MG6596631,Of Materials,Represent question second interview herself with material be
400,E,MG5608046,Feeling Materials,Decide head may black since receive focus later.
200,D,MG9117977,Stock Materials,Care thousand around popular many person work.
300,D,MG4876816,Up Materials,Direction data south campaign network simply since consider.
400,D,MG6294906,Manager Materials,Open catch collection wind give.
100,D,MG3914484,Key Materials,Bring race cold present must ready who thing system approach
100,D,MG2146845,Tonight Materials,Set economy eat right half music phone add develop.
400,D,MG3158797,Environment Material,Democratic word front food cause must.
100,D,MG1085439,Peace Materials,Sea something pretty couple government necessary.
300,D,MG2052102,Break Materials,Community consumer else join feeling may wide degree recentl
400,E,MG2877295,Major Materials,Well perhaps student research five want try call avoid send.
400,E,MG3699560,World Materials,Central cost conference determine bring beat in quality must
300,D,MG1243777,Democrat Materials,Take entire anything support several crime.
200,D,MG5654277,Friend Materials,Teach sister both direction together job fill ever reduce po
300,D,MG5953758,Sign Materials,Option marriage measure grow situation military physical gov
400,E,MG5881881,Edge Materials,Movement national western within agency.
300,D,MG6355197,Why Materials,Side page of quite allow yes entire go.
300,E,MG3452387,Common Materials,Perhaps we air on door employee eat.
100,D,MG9655384,Arrive Materials,However more apply product the paper house check dark best.
100,D,MG9193716,Take Materials,Stage my cut necessary another should thought back world hus
400,E,MG3908376,Sometimes Materials,Old two sit happen you.
100,D,MG1984324,Structure Materials,Behind must large line voice debate available cultural catch
200,D,MG5497695,Truth Materials,Almost person fact true floor answer product great.
100,D,MG7776653,Camera Materials,Ready week program right politics deal.
400,D,MG7163824,Model Materials,Carry set dinner resource maintain.
200,E,MG9150032,Should Materials,Open with small main able.
100,D,MG7736198,Second Materials,Simply say expert organization form generation leader profes
300,E,MG4787041,Model Materials,Others quite room here home threat we a.
400,E,MG5569204,Conference Materials,Skill present near imagine if stop station street.
100,D,MG5269506,Shake Materials,Room firm act property between both everyone write ok.
400,E,MG3032539,Watch Materials,Commercial push force country history recently they policy f
200,D,MG6878397,Section Materials,Responsibility while act low agree current friend front too 
200,E,MG3562883,Best Materials,Subject manage reason start federal wait start recent item.
100,E,MG7570822,Know Materials,Recently watch throw indeed Democrat occur.
300,E,MG1201359,Oil Materials,Attack listen character trip suggest ahead career seem.
400,E,MG6235391,Else Materials,Order receive Mrs discussion personal ready fire fear.
300,E,MG3655286,Song Materials,Land machine lead program attention newspaper.
200,E,MG4431262,Require Materials,Cost land many southern onto remain us.
100,E,MG5927027,Pressure Materials,Writer culture grow smile enter.
100,E,MG3770603,Sing Materials,Movie difficult magazine lay always inside through.
